{
  "trial_observation_version": "0.1",
  "robot_id": "RCL-DEMO-ROVER-A",
  "embodiment_id": "demo-rover-a-v1",
  "captured_at": "2026-08-14T03:10:00Z",
  "behavior_trials": [
    {
      "behavior_id": "navigation.follow_person",
      "metrics": {
        "following_distance_m": [1.34, 1.36, 1.37, 1.38, 1.38, 1.39, 1.40, 1.41, 1.42, 1.45],
        "stop_delay_ms": [320, 330, 340, 345, 350, 355, 360, 370, 380, 390]
      }
    }
  ]
}
